{
 "schema_version": "1.0.0",
 "capture": {
  "id": "c7d28f72c6",
  "tier": "lidar",
  "path": "testdata/c7d28f72c6",
  "device": {
   "app": "Stray Scanner",
   "make": null,
   "model": null,
   "source": "stray"
  },
  "input_stats": {
   "lidar_frames": 9745,
   "odometry_rows": 9745,
   "depth_frames": 9745,
   "confidence_frames": 9745,
   "duration_s": 214.929,
   "rgb_video": true,
   "camera_matrix": true,
   "imu": true,
   "rgb_width": 1920,
   "rgb_height": 1440,
   "rgb_fps": 45.34,
   "rgb_frames": 9745
  },
  "flags": [
   "semantics_surface_evidence_dropped:4",
   "semantics_single_view_dropped:30"
  ]
 },
 "conventions": {
  "units": {
   "length": "m",
   "area": "m2",
   "plan": "x and y in metres in the capture's world frame, z up; room polygons counter-clockwise",
   "scope_quantity": "the unit named on each line item (SF, LF, EA, m2 or m)",
   "score": "detector score in [0, 1] after cross-view merge, not a calibrated probability"
  },
  "interval": {
   "level": 0.9,
   "method": "lidar tier error model. Lengths: sigma = sqrt((v*s)^2 + a^2) with a scale term s = 0.003 shared by every measurement (the larger of the tier floor and the geometry's estimate, with the scale spread across video chunks or the scale error of a rejected loop closure) and additive terms a = 0.008 m (walls), 0.006 m (heights), 0.012 m (openings), 0.020 m (damage), inflated for thin evidence on the measurement and on a wall's two end walls (low observed fraction, few face points, fit residuals in quadrature, low light, fewer than 4 photos or views, missing focal length). A wall ending at a wall with no face of its own may run on by 0.15 of the room's extent along it (at most 3 times the wall's length) and is no shorter than the part of its face that was seen. A wall ending at an unobserved wall or a step (shorter than 0.50 m, or shorter than 1.00 m and low) may be a fragment: its upper bound reaches the pieces beyond the step or the room's extent along the wall. Heights add a vertical term of 0.00 (log); an unobserved floor or ceiling widens the upper side by z*0.50 m, an unobserved ceiling up to 4.0 m; a door with no head edge found reaches down to 1.90 m. Areas: sqrt((2*A*s)^2 + (sum of L_i*a_i)^2) plus unobserved wall positions, and upward to the bounding box when a wall may be a fragment. Footprint: scale term fully correlated across rooms plus independent per-room terms; unplaced rooms widen footprint and extents 1.5x. Interval = value - z*q*sigma to value + z*q*sigma_hi with z = 1.645, the one-sided terms widening only their side, lo clipped at 0; q = 1.00, prior value: not calibrated, this tier has fewer than 9 ground-truth rooms. Wall surface areas combine the length, height and opening intervals by interval arithmetic.",
   "q": 1.0,
   "calibration": "prior"
  },
  "definitions": {
   "wall_length": "face to face at 1 m height between the two neighbouring walls, along the room polygon edge",
   "wall_height": "floor plane to ceiling plane distance at the wall",
   "ceiling_height": "floor plane to ceiling plane distance inside the room",
   "opening_width": "clear width between the jamb faces",
   "opening_height": "floor to the underside of the head for doors and passages; inside the frame for windows",
   "opening_offset": "along the wall, from the wall start to the near jamb of the opening",
   "sill": "floor to the window sill",
   "floor_area": "polygon area of the interior wall faces",
   "perimeter": "sum of the room's wall lengths",
   "wall_surface_area": "wall length times wall height minus the areas of the openings in that wall",
   "ceiling_surface_area": "equal to the floor area (flat ceiling assumed)",
   "footprint": "sum of the room floor areas; walls between rooms are not included",
   "extent": "size of the bounding box of all room polygons along plan x and plan y",
   "damage_extent": "width along the surface u axis and height along v of the damage region; area of its mask projected onto the surface; walls use u from the wall start and v from the floor, floors and ceilings use plan x and y"
  }
 },
 "property": {
  "footprint_area": {
   "value": 61.7763,
   "lo": 58.5726,
   "hi": 90.357,
   "unit": "m2"
  },
  "extent_x": {
   "value": 9.7137,
   "lo": 9.6509,
   "hi": 9.7765,
   "unit": "m"
  },
  "extent_y": {
   "value": 10.3443,
   "lo": 10.2791,
   "hi": 10.4095,
   "unit": "m"
  },
  "adjacency": [
   {
    "room_a": "R1",
    "room_b": "R2",
    "opening_a": "R1-O2",
    "opening_b": null,
    "confidence": 0.6888,
    "source": "shared_frame"
   },
   {
    "room_a": "R2",
    "room_b": "R3",
    "opening_a": "R2-O1",
    "opening_b": "R3-O2",
    "confidence": 0.9342,
    "source": "shared_frame"
   },
   {
    "room_a": "R2",
    "room_b": "R3",
    "opening_a": "R2-O2",
    "opening_b": null,
    "confidence": 0.679,
    "source": "shared_frame"
   },
   {
    "room_a": "R2",
    "room_b": "R7",
    "opening_a": "R2-O3",
    "opening_b": "R7-O1",
    "confidence": 0.7999,
    "source": "shared_frame"
   },
   {
    "room_a": "R3",
    "room_b": "R4",
    "opening_a": "R3-O1",
    "opening_b": "R4-O2",
    "confidence": 0.7868,
    "source": "shared_frame"
   },
   {
    "room_a": "R4",
    "room_b": "R6",
    "opening_a": "R4-O1",
    "opening_b": "R6-O3",
    "confidence": 0.6748,
    "source": "shared_frame"
   },
   {
    "room_a": "R4",
    "room_b": "R5",
    "opening_a": null,
    "opening_b": "R5-O1",
    "confidence": 0.6859,
    "source": "shared_frame"
   }
  ],
  "drift_correction": {
   "enabled": true,
   "segments": 72,
   "loop_closures_tried": 122,
   "loop_closures_accepted": 38,
   "max_translation_correction_m": 0.1964,
   "max_yaw_correction_deg": 1.125,
   "floor_z_spread_before_m": 0.1293,
   "floor_z_spread_after_m": 0.0183,
   "stages": {
    "loop_closure": true,
    "plane_anchoring": true,
    "manhattan_anchoring": true
   },
   "loop_closures": [
    {
     "round": 1,
     "segments": [
      47,
      54
     ],
     "screen_overlap": 0.71,
     "rmse_m": 0.0173,
     "overlap": 0.42,
     "shift_m": 0.0475,
     "yaw_deg": -2.023,
     "dof": 5,
     "accepted": true,
     "reason": null
    },
    {
     "round": 1,
     "segments": [
      5,
      44
     ],
     "screen_overlap": 0.7,
     "rmse_m": 0.0238,
     "overlap": 0.43,
     "shift_m": 0.0852,
     "yaw_deg": -0.055,
     "dof": 4,
     "accepted": false,
     "reason": "rmse"
    },
    {
     "round": 1,
     "segments": [
      1,
      34
     ],
     "screen_overlap": 0.68,
     "rmse_m": 0.0153,
     "overlap": 0.394,
     "shift_m": 0.0629,
     "yaw_deg": 0.646,
     "dof": 5,
     "accepted": true,
     "reason": null
    },
    {
     "round": 1,
     "segments": [
      10,
      17
     ],
     "screen_overlap": 0.677,
     "rmse_m": 0.0106,
     "overlap": 0.486,
     "shift_m": 0.063,
     "yaw_deg": 0.318,
     "dof": 6,
     "accepted": true,
     "reason": null
    },
    {
     "round": 1,
     "segments": [
      10,
      19
     ],
     "screen_overlap": 0.662,
     "rmse_m": 0.0184,
     "overlap": 0.386,
     "shift_m": 0.0121,
     "yaw_deg": 0.211,
     "dof": 5,
     "accepted": true,
     "reason": null
    },
    {
     "round": 1,
     "segments": [
      4,
      23
     ],
     "screen_overlap": 0.66,
     "rmse_m": 0.0094,
     "overlap": 0.585,
     "shift_m": 0.0171,
     "yaw_deg": 0.155,
     "dof": 5,
     "accepted": true,
     "reason": null
    },
    {
     "round": 1,
     "segments": [
      10,
      18
     ],
     "screen_overlap": 0.657,
     "rmse_m": 0.0213,
     "overlap": 0.48,
     "shift_m": 0.0368,
     "yaw_deg": -0.257,
     "dof": 6,
     "accepted": false,
     "reason": "rmse"
    },
    {
     "round": 1,
     "segments": [
      38,
      68
     ],
     "screen_overlap": 0.652,
     "rmse_m": 0.0096,
     "overlap": 0.541,
     "shift_m": 0.1146,
     "yaw_deg": -0.107,
     "dof": 5,
     "accepted": true,
     "reason": null
    },
    {
     "round": 1,
     "segments": [
      4,
      22
     ],
     "screen_overlap": 0.632,
     "rmse_m": 0.0144,
     "overlap": 0.535,
     "shift_m": 0.021,
     "yaw_deg": -1.017,
     "dof": 5,
     "accepted": true,
     "reason": null
    },
    {
     "round": 1,
     "segments": [
      46,
      53
     ],
     "screen_overlap": 0.632,
     "rmse_m": 0.0204,
     "overlap": 0.415,
     "shift_m": 0.1363,
     "yaw_deg": 0.077,
     "dof": 6,
     "accepted": false,
     "reason": "rmse"
    },
    {
     "round": 1,
     "segments": [
      10,
      20
     ],
     "screen_overlap": 0.627,
     "rmse_m": 0.0209,
     "overlap": 0.376,
     "shift_m": 0.0476,
     "yaw_deg": 2.606,
     "dof": 5,
     "accepted": false,
     "reason": "rmse"
    },
    {
     "round": 1,
     "segments": [
      46,
      54
     ],
     "screen_overlap": 0.62,
     "rmse_m": 0.0252,
     "overlap": 0.31,
     "shift_m": 0.1221,
     "yaw_deg": -3.598,
     "dof": 5,
     "accepted": false,
     "reason": "rmse"
    },
    {
     "round": 1,
     "segments": [
      18,
      55
     ],
     "screen_overlap": 0.615,
     "rmse_m": 0.0199,
     "overlap": 0.363,
     "shift_m": 0.1341,
     "yaw_deg": -0.534,
     "dof": 4,
     "accepted": true,
     "reason": null
    },
    {
     "round": 1,
     "segments": [
      0,
      37
     ],
     "screen_overlap": 0.59,
     "rmse_m": 0.0236,
     "overlap": 0.382,
     "shift_m": 0.0051,
     "yaw_deg": 0.091,
     "dof": 6,
     "accepted": false,
     "reason": "rmse"
    },
    {
     "round": 1,
     "segments": [
      1,
      39
     ],
     "screen_overlap": 0.583,
     "rmse_m": 0.016,
     "overlap": 0.43,
     "shift_m": 0.0545,
     "yaw_deg": 0.463,
     "dof": 5,
     "accepted": true,
     "reason": null
    },
    {
     "round": 1,
     "segments": [
      41,
      57
     ],
     "screen_overlap": 0.583,
     "rmse_m": 0.0132,
     "overlap": 0.39,
     "shift_m": 0.1686,
     "yaw_deg": -0.928,
     "dof": 5,